company_name,website,year_founded,description,problem_statement,pitch_deck_link,demo_link,Team_Score,Technology_Score,Traction_Score,Team_Justification,Technology_Justification,Traction_Justification,Team_Business Model Strength,Team_Execution Capability,Team_Market Positioning,Team_Strategic Vision,file_name
Magier AI,https://www.magier.ai/,2024,"Magier AI is an enterprise-grade AI DLP platform that lets employers unlock GenAI productivity without risking HIPAA or GDPR leaks. Our real-time engine scrubs 150+ PII types in ≤30 ms, integrates with any LLM or browser, and equips brokers and health plans to deploy AI safely—trusted by gener8tor firms.","Generative-AI adoption is racing ahead of security: 75% of employees already paste customer or patient data into ChatGPT-style tools. Each prompt can exfiltrate HIPAA- or GDPR-protected PII/PHI, exposing employers, brokers, and health plans to average breach costs of $4.45 M, $50k-per-record fines, and lost IP. Legacy DLP can’t scan natural-language prompts or respond in real time, so CISOs either ban GenAI—surrendering a projected 30% productivity lift—or accept existential risk. Magier eliminates the trade-off by redacting 150+ sensitive data types in ≤30 ms at the browser and API layer, letting organizations unlock GenAI safely and compliantly.",https://drive.google.com/file/d/1Lf1aCBmXOTEuzQjJOXEDh3pnjMdrutPr/view?usp=sharing,https://www.youtube.com/watch?v=INmF8ryGps4,4,5,4,"The founding team of Magier AI demonstrates strong execution ability and domain expertise. Ranice Brown, the CEO, brings enterprise-security relationships and product instinct from her experience at Meta Reality Labs. Arnob Hossain, the CTO, has over seven years of experience in building low-latency AI inference pipelines, which is crucial for the company's core technology. The team has complementary skills, with Donyã Green focusing on UX/UI and front-end engineering. The team has shown leadership and the ability to execute on their vision, as evidenced by their rapid pivot from a consumer app to an enterprise solution.","Magier AI's technology is highly defensible, with a proprietary engine capable of redacting 150+ PII types in less than 30 ms. The use of proprietary models and microservices stored in private repositories adds to the technical moat.","Magier AI has demonstrated strong traction with three paying customers and four signed pilots. The company has achieved significant milestones, including product launches and compliance audits, indicating strong product-market fit.","Magier AI employs an enterprise SaaS model with a land-and-expand strategy. The revenue model includes annual subscriptions, usage-based API add-ons, and OEM/broker channels, which provide scalability and predictable ARR.","The team has demonstrated strong execution capability by securing paying customers, signing pilots, and achieving product milestones such as SOC-2 compliance and API launches.","The company positions itself as a real-time AI DLP solution that allows organizations to safely leverage GenAI. Its unique value proposition lies in its ability to redact sensitive data in less than 30 ms, differentiating it from competitors.","Magier AI has a clear strategic vision to become a leader in AI DLP by focusing on healthcare, insurance, and financial services, leveraging broker and TPA channels for distribution.",magier_ai_comprehensive_analysis.json
Funli MB,https://rizzup.me/,2025,We are creating social game platform for teens and event organizers,"Ice-breaker social games create an environment where strangers can have better relationship, current social games are dud",https://www.canva.com/design/DAGt3zN0aes/dFHLwFbLEehfRuIBpX_Qrg/edit?utm_content=DAGt3zN0aes&utm_campaign=designshare&utm_medium=link2&utm_source=sharebutton,https://play.google.com/store/apps/details?id=com.ug.rizzup,3,3,2,"The founding team has complementary skills and prior experience working together, which is a positive indicator of execution capability. However, the team is small, and there are concerns about their ability to scale operations quickly.","The technology is functional and has attracted users, but lacks clear defensibility and scalability plans.","Initial user acquisition is promising, but lack of paying customers and unclear monetization strategy are concerns.",The subscription model is straightforward but may face challenges in converting free users to paying customers. Scalability is possible but requires significant marketing efforts.,"The team has demonstrated initial traction with 5.5k players but lacks paying customers, indicating a need for better monetization strategies.",The company targets a niche market of teens and event organizers with a unique value proposition of affordable social games.,"The leadership has a clear vision to scale to 10M users, but the path to achieving this is not well-defined.",funlimb_comprehensive_analysis.json
NION Neuroscience,https://www.nionneuroscience.com/,2022,"Safe, Efficient & Immediate Focus Elevation",Students Facing ADHD (Ages 21-30) to reclaim their academic potential; people facing Clinical Depression (Age 14-50) to reclaim their harmony; Business Professionals Managing Addictions (Ages 30-55) to strengthen their executive control; Adults Concerned About Cognitive Decline (Ages 55-75) to preserve and enhance their mental sharpness.,https://drive.google.com/file/d/1I0PELYP1iA_PKLLyUGHEw3TXJLW_NVjD/view?usp=drive_link,https://www.youtube.com/watch?v=54yntv6fhO4&t=2s,3,4,2,"The founding team has a diverse set of skills and backgrounds, with experience in neuroscience, technology, and marketing. However, the team size is small, and there is a lack of demonstrated scaling experience.","The technology offers real-time data measurement and non-prescription use, providing a competitive edge.","Limited traction with 10 pre-orders and over 30 pilots, but no significant revenue growth.","The business model relies on sales commissions and collaborations, which could be scalable but lacks clarity on unit economics.",The team has shown some ability to execute with pre-orders and pilots but lacks significant market traction.,"NION Neuroscience positions itself as a non-prescription, adjustable headband solution, differentiating from chemical competitors.","The strategic vision includes expanding market reach and establishing a medical guarantee, but execution plans are not fully detailed.",nionneuroscience_comprehensive_analysis.json
Sunny Health AI,https://sunnyhealth.ai/,2025,"Consumer healthcare concierge easily embeddable in employer, payer, and provider apps","Healthcare navigation is broken. Most people don’t know how to find in-network care, what’s covered, or where to go when they need help, resulting in delayed treatment, unnecessary ER visits, and billions in wasted claims. Despite employers and payers spending heavily on benefits, usage is low because the experience is fragmented, slow, and confusing.

Sunny Health solves this with an AI-powered concierge that understands your health plan, finds the right providers, checks eligibility in real-time, and books appointments, all through a simple embeddable chat. No apps. No hold times. No guesswork.

This matters because the current healthcare navigation isn’t just frustrating, it’s costly. It leads to worse outcomes for patients and higher spend for employers and insurers. Our solution increases benefits utilization, improves time-to-care by 60%, and reduces avoidable claims, unlocking ROI for all stakeholders.",https://docsend.com/view/v2vx857qzm3iwdnj,https://sunnyhealth.ai/chat,4,4,3,"The founding team of Sunny Health AI demonstrates strong execution ability and domain expertise. Bilal Farooqui, CEO, has a background in healthcare product development and leadership experience at RVO Health. Bo Wang, Chief Medical Officer, combines clinical expertise with technical skills, enhancing the product's credibility. Nik Yanek-Chrones, CTO, is a full-stack AI engineer with a proven track record of delivering high-quality code. The team's complementary skills and prior achievements position them well for scaling the venture.","Sunny Health AI's technology is defensible and scalable, leveraging AI to provide real-time healthcare navigation. The solution is differentiated by its integration capabilities and speed, offering a competitive moat.","Sunny Health AI has launched a consumer alpha version and is in discussions for its first employer pilot. While early traction is promising, the company lacks a scalable sales pipeline and significant customer validation.","Sunny Health AI employs a PE/PM and PM/PM revenue model targeting employers and payers. The model is scalable, leveraging AI to reduce costs and improve efficiency compared to human-led solutions.",The team has demonstrated the ability to execute by launching a consumer alpha version and engaging in pilot discussions with employers.,"The company positions itself as an AI-native healthcare concierge, differentiating through speed, integration, and cost-effectiveness. Its unique value proposition lies in eliminating the need for apps and reducing hold times.","Sunny Health AI has a clear vision to integrate deeply with existing systems, addressing a significant market pain point and aligning with industry trends.",sunny_health_ai_comprehensive_analysis.json
MediaUClips Corporation,https://www.mediauclips.com,2022,"MediaUClips is a digital health video platform empowering creators to share wellness content via live streams, shorts, and shoppable media centered on monetization, equity, impact, and cultural relevance.","MediaUClips addresses the lack of accessible, culturally relevant, and monetizable wellness content for diverse creators and audiences. By bridging health education with creator economy tools, we empower underrepresented voices, improve health literacy, and drive equitable economic opportunities in the digital wellness space.",https://docs.google.com/presentation/d/12Jj0q-0ugWVrnlmD0fm127ZipfShLocB-oQ64cqS5D8/edit?usp=sharing,https://youtu.be/YcbQwzaWSPc?feature=shared,3,3,3,"The founding team has a strong personal connection and shared values, which is a positive indicator of cohesion. However, the team size is very small, and there is a lack of detailed information on their execution ability and prior wins in similar ventures.","The platform leverages live streaming and shoppable media, but the reliance on external partners for key technology components raises concerns about defensibility.","The platform has achieved initial traction with 4 million visits and 3,300 registered users, but lacks paying customers and detailed growth metrics.","The business model is focused on monetization through transaction fees, subscriptions, and advertising. However, the lack of current paying customers raises concerns about the immediate viability of this model.","The team has managed to launch the platform and gain initial traction, but the small team size and reliance on external partners for technical development may hinder rapid scaling.","MediaUClips positions itself as a culturally relevant platform for wellness content, differentiating from general video platforms and wellness apps by focusing on underrepresented creators.","The strategic vision is clear in terms of empowering diverse creators and focusing on monetization, but the roadmap for achieving sustainable growth and scaling is not fully detailed.",mediauclipscorporation_comprehensive_analysis.json
Outro Health,https://www.outro.com/,2022,"The first virtual platform for deprescribing, starting with the 50M Americans on antidepressants. We leverage the first neuroscience-based tapering method, invented by our co-founder.","We're solving the absence of dedicated deprescribing solutions for several drug classes, used by 100M+ people in the western world. Particularly for psychiatric medications: 10s of millions are using the drugs for longer than guidelines recommend - subject to side effects and long-term effects - and withdrawal symptoms keep them trapped on medications (and drives up healthcare costs). We believe that deprescribing will become a revolutionary category of medicine - a response to the epidemic of overprescribing.",https://www.outro.com/,https://vimeo.com/1080895047/bd19543f1f,4,4,4,"The founding team of Outro Health demonstrates strong domain expertise and complementary skills. Brandon Goode, CEO, has a background in healthcare commercialization, which complements Dr. Mark Horowitz's medical expertise and status as a key opinion leader in deprescribing. The team has shown the ability to scale operations, as evidenced by their growth in clinical staff and revenue.","Outro Health's technology is based on a neuroscience-based tapering method, providing a defensible and differentiated approach. The platform's scalability and integration capabilities are promising.","Outro Health has demonstrated strong traction with 24% MoM revenue growth, a growing patient base, and a significant waitlist. The company is still in beta but shows promising signs of product-market fit.","Outro Health's business model is based on a subscription service for taper management, with plans to expand into fee-for-service and value-based care models. The model shows potential for scalability and competitive positioning in a niche market.","The team has demonstrated execution capability by launching in the US, achieving 24% MoM revenue growth, and scaling their clinical team.","The company positions itself as a pioneer in the emerging field of deprescribing, leveraging a unique neuroscience-based tapering method. This differentiation is a strong competitive advantage.","Outro Health has a clear strategic vision to expand its deprescribing platform to include payers and employers, aiming to reduce pharmacy spend and associated healthcare costs.",outro_health_comprehensive_analysis.json
GTMFlow,https://www.gtmflow.com,2021,"GTMFlow equips executives and organizations with the mindset and tools to thrive through curveballs—unexpected challenges that disrupt performance. Our executive cancer coaching is a scalable benefit that supports employees navigating diagnosis or caregiving, helping them balance work, treatment, and communication to stay resilient and productive.","A cancer diagnosis is profoundly destabilizing—especially for executives responsible for leading teams, driving strategy, and managing critical customer and investor relationships. These leaders are expected to deliver clarity, momentum, and stability—while suddenly navigating medical decisions, emotional strain, and physical disruption. Most employers offer insurance and clinical support, but they lack real-time, experienced, executive-centric coaching to help executives process the diagnosis, communicate with stakeholders, and balance their dual responsibilities to their health and their company.

Without targeted support, executives often withdraw, make reactive decisions, or disappear from the business when their leadership is most needed. This creates ripple effects across teams and priorities, leading to unnecessary leaves, stalled initiatives, and cultural instability. GTMFlow closes this gap by delivering executive-grade coaching that helps leaders develop a plan, communicate confidently, and stay engaged—so they can protect their health and business continuity.",https://docs.google.com/presentation/d/16-PULH2wlOu-TV7iXXNWDfsUxQ9LxWnSbY3ShOPpols/edit?usp=sharing,https://share.descript.com/view/4zU8JcMWofj,3,3,2,"The team is currently a solopreneur-led venture, which presents challenges in scaling and execution. The founder, Joelle Kaufman, has relevant experience and a strong personal motivation, but the lack of a broader team limits the company's ability to execute at scale.","The technology is primarily based on proprietary coaching methods and existing AI platforms. While innovative, it lacks significant technical defensibility or IP protection.","The company is in the pre-launch phase with limited traction. While there is evidence of need, there are no paying customers or significant market penetration yet.","The business model is based on a PEPM fee structure, which is scalable but requires significant market penetration and partnerships to be effective.","Execution capability is currently limited by the small team size, but the founder's experience and planned partnerships could enhance this.","GTMFlow positions itself uniquely by focusing on executive cancer coaching, a niche not fully addressed by existing well-being apps and EAPs.","The strategic vision is clear, focusing on a significant unmet need in the market, but requires further development in terms of scaling and operational execution.",gtmflow_comprehensive_analysis.json
Carefam,https://www.carefam.com/,2023,"Carefam builds AI agents for Healthcare HR. Our wedge product, live in 170 NJ and MA facilities, automates repetitive tasks in clinical hiring. Next, we're developing agents to support the full clinician career journey, from retention and L&D to career growth and more, streamlining HR across the workforce lifecycle","As the U.S. population ages, the country faces a projected shortage of over two million clinicians over the next decade, spanning nurses, aides, and other essential healthcare roles. This Care Crisis threatens patient access, quality of care, and the stability of the entire healthcare system. Addressing the crisis requires a multi-pronged approach - training more clinicians, improving retention, and making healthcare careers more sustainable. At Carefam, we’re starting where impact can be felt fastest: optimizing how the existing clinical workforce finds its next job and thrives once in it. By reducing friction in hiring, helping clinicians grow their careers, and improving retention, we strengthen the backbone of the entire healthcare system. A high-functioning healthcare workforce is one of the most important imperatives for ensuring America’s health and prosperity in the decades ahead",https://docsend.com/view/8w9v6xendeb9zj96,https://docsend.com/view/jv3xqcgh8ymdp7ar,4,4,5,"The founding team of Carefam demonstrates strong execution ability and complementary skills. Matan Hoffmann and Eyal Shulman have a solid professional connection and have successfully validated their concept. Their leadership signals are positive, with a clear understanding of their strengths and areas for growth.","Carefam's AI technology is a key differentiator, providing scalability and defensibility. However, the lack of detailed IP strategy is a concern.","Carefam has demonstrated strong traction with $2M in contracts, $1.2M in annual revenue, and 20K clinician profiles. The go-to-market execution is impressive.","Carefam's business model is robust, with a flat fee per hire and a SaaS-like revenue stream. The model is scalable and aligns well with the healthcare industry's needs.",The team has demonstrated execution capability by securing $2M in contracts and $1.2M in annual revenue with limited sales resources.,"Carefam positions itself as an AI-native solution for healthcare HR, differentiating from competitors by supporting the entire clinician career journey.","Carefam's strategic vision is to streamline HR across the workforce lifecycle, addressing critical pain points in clinician hiring and retention.",carefam_comprehensive_analysis.json
Subconscious AI,https://www.subconscious.ai/,2023,A behavioral simulation engine that empowers enterprises and policymakers to run in-silico experiments on human decision-making before real-world deployment.,"Legacy research methods (surveys, A/B tests) are slow, costly, and reactive. We provide proactive, scalable behavioral insights to guide decisions with precision and speed.",https://app.trustfinta.com/i/avi-yashchin-investments/docs/jR1uFtFm9,https://app.subconscious.ai,4,5,4,"The founding team has strong domain expertise and complementary skills, with backgrounds in behavioral research from prestigious institutions like UPenn and MIT. The team has demonstrated execution capability by securing pilot projects with Fortune 500 companies.","The technology is highly differentiated with a focus on causal simulation, providing a strong competitive moat and defensibility.","Strong traction with 70+ enterprise MAUs, $10k MRR, and a $750k pipeline ARR, indicating good product-market fit and growth potential.","The B2B SaaS model with licensing for seats and experiments is scalable and aligns with industry standards. The pricing strategy is competitive, with a clear path to revenue growth.","The team has successfully executed pilots with major enterprises, indicating strong operational capabilities.","Subconscious AI positions itself uniquely by offering causal simulation capabilities, differentiating from traditional research firms and survey platforms.",The leadership has a clear vision to disrupt traditional research methods with innovative simulation technology.,subconsciousai_comprehensive_analysis.json
Counter Fin,https://www.counterfin.com,2024,"Counter is a TurboTax-style assistant for disability and leave claims. Our platform automates claim filings, builds financial readiness through savings tools, and offers predictive scoring and emergency support to reduce delays, denials, and stress during life’s hardest moments. We empower users with faster access to income and dignity.","70% of SSDI claims and 75% of private disability claims are denied due to missing info or errors. Most Americans can't survive a delayed paycheck. Counter eliminates costly denials, filing delays, and financial stress through guided filing, emergency funds, and employer/community support — especially for working-class and underserved populations.",https://www.canva.com/design/DAGnSc9z6HU/pVsBy9qQw620RlTL2vr6Ow/edit?utm_content=DAGnSc9z6HU&utm_campaign=designshare&utm_medium=link2&utm_source=sharebutton,https://www.youtube.com/watch?v=BdCHV8uOrLY,4,4,4,"The founding team has strong domain expertise and personal experience with the problem they are solving, which enhances their credibility and understanding of the market. The CEO and CTO met through Y Combinator, indicating a network of support and validation. The team is small but focused, with a clear division of roles.","The technology is developed in-house, providing control and flexibility. The platform's automation and predictive scoring are key differentiators.","Strong early traction with contracts, partnerships, and pilot programs. The company has demonstrated product-market fit through live events and user feedback.","Counter Fin employs a SaaS model with a tiered pricing structure, which is scalable and allows for predictable revenue streams. The addition of claim fees and platform fees diversifies income sources.","The team has demonstrated execution capability by launching an MVP, securing contracts, and forming partnerships with significant players in the disability space.","The company positions itself uniquely by combining filing automation, predictive scoring, and emergency funding, which competitors lack. This integrated approach addresses multiple pain points in the disability claims process.","The leadership has a clear vision of empowering underserved populations with faster access to income and dignity, aligning with social impact goals.",counterfin_comprehensive_analysis.json
