company_name,website,year_founded,description,problem_statement,pitch_deck_link,demo_link,Team_Score,Technology_Score,Traction_Score,Team_Justification,Technology_Justification,Traction_Justification,Team_Business Model Strength,Team_Execution Capability,Team_Market Positioning,Team_Strategic Vision,file_name
UnitedCode,https://unitedcode.net,2019,"UnitedCode is a data-driven, AI-powered platform transforming tech recruitment. Since 2019, we’ve applied advanced analytics to evaluate developers’ skills, career histories, and profiles with unmatched precision. Combined with our proprietary resume format, expert recruiters, and sourcing in 25 countries, we deliver rigorously vetted talent through a fully transparent, flat-fee model.","We are solving one of the most painful operational problems for scaling tech companies: hiring the right engineers - faster and with unmatched precision. The tech hiring market is at a breaking point. AI is rapidly advancing, and simply “knowing how to code” is no longer enough, projects now demand developers with highly specific, often niche, real-world experience that AI cannot replicate. Competition for these specialists has already begun, with global tech giants like Microsoft, Google, and Nvidia preparing talent pipelines years in advance. The number of technologies, frameworks, and versions is exploding, making it impossible for even the most seasoned recruiters to accurately classify and match skills to project needs. The outdated resume format, unchanged for decades, fails to capture the depth, relevance, and evolution of a developer’s expertise. It works for filtering entry-level or non-technical candidates, but breaks entirely when assessing high-caliber engineers in an AI-driven world. Left unaddressed, this problem will intensify: demand for specialized talent will far outstrip supply, hiring costs will soar, mismatches will become more frequent, and companies will lose valuable time, money, and market opportunities.",https://app.box.com/s/k2li08zyobshs68xe3achndimjlj4urp,https://app.box.com/s/2gtl8fzg58nm2ohf1ottmboo1padz95z,4,5,4,"The founding team of UnitedCode demonstrates strong execution ability with over 19 years of IT experience. The complementary skills of the co-founders, with one focusing on technical implementation and the other on product management, provide a solid foundation for scaling. Their prior experience in building successful ventures and managing large projects adds credibility to their leadership capabilities.","UnitedCode's technology is highly differentiated, leveraging AI and advanced analytics to transform tech recruitment. The proprietary resume format and in-house developed platform provide a strong competitive moat.",UnitedCode has demonstrated strong traction with 33 customers and 8 active paying clients. The company's growth metrics and customer validation indicate a solid product-market fit.,"UnitedCode operates on a transparent, recurring revenue model with a flat-fee structure, which simplifies budgeting for clients and fosters long-term relationships. The model is scalable and aligns well with the needs of tech companies seeking specialized talent.",The team has demonstrated execution capability by automating their candidate selection process and expanding their market reach to 25 countries. Their ability to deliver on their vision is evident in their current traction.,"The company positions itself as a solution to the outdated recruitment models, offering precision in matching developers to project needs. Their unique value proposition lies in their AI-powered platform and proprietary resume format.",UnitedCode's strategic vision is to address the growing demand for specialized tech talent by leveraging AI and advanced analytics. Their focus on refining their go-to-market strategy and scaling operations aligns with their long-term goals.,unitedcode_comprehensive_analysis.json
Skillsize,https://www.skillsize.io,2021,"Skillsize builds AI-powered workforce intelligence tools. Our latest product, XPQ, benchmarks executive career trajectories to predict leadership performance, de-risk appointments, and accelerate succession planning.","Leadership mis-hires cost millions and can derail company strategy. Current assessments rely on subjective interviews and generic psychometrics. XPQ uses proprietary career signals and AI benchmarking to objectively evaluate leadership potential, enabling better hiring, succession, and portfolio value creation.",https://www.canva.com/design/DAGv2m7bwaY/Iadz36-hnXxKNjSfecaf1A/view?utm_content=DAGv2m7bwaY&utm_campaign=designshare&utm_medium=link2&utm_source=uniquelinks&utlId=h2d6623cb5f,https://www.canva.com/design/DAGv-V3VDUg/4gDD3jfuuNd-DNdGsRhOXA/view?utm_content=DAGv-V3VDUg&utm_campaign=designshare&utm_medium=link2&utm_source=uniquelinks&utlId=h676a00cabc,4,4,4,"The founding team consists of brothers with complementary skills. Michael Boham brings strategic and commercial leadership, while Samuel Boham offers extensive software and big data expertise. Their prior collaboration on technology ventures and domain expertise in consulting and analytics strengthen their execution capability.","Skillsize's AI-powered tools offer technical differentiation through proprietary career signals and benchmarking. The technology is scalable and defensible, with potential for integration into partner platforms.","Skillsize has demonstrated strong traction with pilots, paying customers, and positive feedback. The transition to a SaaS model and ongoing engagements indicate product-market fit.","Skillsize employs a B2B SaaS licensing model, project-based pricing, and API access, which are scalable and align with industry standards. The transition to a service delivery model indicates adaptability.",The team has demonstrated execution capability by securing pilots with PE firms and generating revenue from paid assessments. Their ability to pivot based on feedback shows strategic agility.,"Skillsize positions itself as a data-driven alternative to traditional psychometric assessments, offering predictive insights into leadership potential. This differentiation is crucial in a conservative market.",The company's vision to integrate XPQ into partner platforms and refine its GTM playbook for PE and executive search firms indicates a clear strategic direction.,skillsize_comprehensive_analysis.json
WayPave LLC,https://waypave.com,2024,"WayPave is an hourly hiring platform using patent-pending swipe-to-match technology to connect local, qualified candidates with employers across industries. Our matching platform empowers businesses to build high-performing teams while giving hourly job seekers opportunity in real-time.","WayPave solves the inefficiency and inequity in hourly hiring. Traditional job boards overwhelm employers with unqualified applicants and leave job seekers in the dark about pay, schedule, fit, or next steps. This matters because over 80 million Americans work hourly jobs, yet the hiring process is slow, biased, and broken, which hurts both businesses and people. WayPave drives economic mobility and allows job seekers to make better financial decisions for themselves and their families.",https://waypave.com/investor-resources,https://waypave.com/investor-resources,4,4,3,"The founding team of WayPave LLC demonstrates strong execution ability and domain expertise. Benjamin Cline and Christopher Medenwald have complementary skills in technology and operations, which are crucial for scaling the platform. Their decision to work together after a period of 'dating' indicates a thoughtful approach to team dynamics.","WayPave's technology is defensible with its patent-pending swipe-to-match feature, offering a unique and scalable solution in the hiring space.","WayPave has shown promising early traction with 20 businesses signed up and 3 paying customers. However, the transition from pilot to broader market adoption remains a key challenge.",WayPave's B2B SaaS model with tiered subscription plans is scalable and offers high-margin recurring revenue. The model is well-positioned to capture a significant share of the hourly hiring market.,The team has demonstrated the ability to execute by launching the product in-market within a year and securing pilot partnerships with notable brands like Chick Fil A.,"WayPave differentiates itself with its swipe-to-match technology, offering a unique value proposition in a crowded market. The focus on real-time matching and transparency addresses key pain points for both employers and job seekers.","WayPave's strategic vision to expand into retail, manufacturing, and healthcare by 2025 shows a strong understanding of market opportunities and a clear growth trajectory.",waypave_llc_comprehensive_analysis.json
Cognitiveview,https://www.cognitiveview.com,2022,"CognitiveView is an AI Governance platform for regulated industries. Our audit module, TRACEâRAI, transforms GenAI evaluation scores into signed, compliance-ready evidence. Weâre helping hospitals, governments, and enterprises meet HIPAA, HITRUST, and EU AI Act requirementsâalready deployed across 80â100 hospitals and piloting with the U.S. Department of Defense.","GenAI adoption is outpacing regulation, and enterprises â especially in healthcare and government â have no standardized way to prove their AI systems are safe, fair, or compliant. Existing tools generate metrics, but not audit-ready evidence. This gap blocks procurement, increases risk, and erodes trust in critical sectors.",https://docsend.com/view/92k2unn4p7kypadf,https://drive.google.com/file/d/19VjdAZOzaGG6zYw-UEFoNGspwDgB0Xqw/view?usp=sharing,4,4,4,"The team is led by a founder with strong technical expertise and a clear understanding of the AI governance space. The team is lean but has a strong focus on execution, with a significant portion of the team dedicated to engineering and product development. The founder's background and the team's technical depth are strong indicators of their ability to execute the company's vision.","CognitiveView's technology is differentiated by its focus on audit-ready compliance evidence and automation. The core technology is built in-house, providing defensibility and scalability.","CognitiveView has demonstrated strong early traction with significant pilots, early revenue, and strategic partnerships. The focus on converting pilots to ARR is a positive indicator of growth potential.",The SaaS subscription model is scalable and aligns well with the needs of compliance-conscious enterprises. The company has already generated early revenue and has a clear path to scaling through enterprise contracts.,"The team has demonstrated strong execution capability by securing significant pilots and early revenue, indicating their ability to deliver on their vision.","CognitiveView positions itself as a leader in AI governance, focusing on audit-ready compliance evidence, which is a unique value proposition in the market.",The company's strategic vision to become the default audit and compliance infrastructure for GenAI across regulated industries is ambitious and well-aligned with market needs.,cognitiveview_comprehensive_analysis.json
Axima AI,http://axima.ai/,2025,Axima.ai - building AI agents that help medical groups collect 99%+ of revenue at 70% lower cost.,"We solve the massive inefficiency in the U.S. healthcare revenue cycle, where medical centers annually:
1. Lose or freeze $494B due to denied or delayed insurance claims;
2. Miss out on $736B in patient payments due to low collection rates (47.8%);
3. Spend $600B chasing payments with outdated, manual processes.

We had a conversation with 30+ medical groups and everybody told us that receiving payments from payors and patients is the one of the biggest challenge in their business.",https://brieflink.com/v/0pybf,https://drive.google.com/drive/u/0/home,4,5,4,"The founding team of Axima AI is composed of highly skilled individuals with complementary expertise. Anton Bereza, the CEO, has a strong background in healthcare and leadership. Max Zavyalov, the CTO, is a top-tier engineer with experience at Meta, bringing deep technical expertise in AI. Alex Svitnev, the CPO, has extensive experience in healthcare product leadership. The team has demonstrated the ability to execute quickly, signing significant ARR contracts within 90 days.","Axima AI's technology is highly defensible, leveraging proprietary algorithms, APIs, RPA, Voice AI, and Gen AI to automate the entire revenue cycle. The solution is scalable and integrates seamlessly with existing systems, providing a strong competitive moat.","Axima AI has demonstrated strong traction with $108K+ in ARR, $1.8M in contracted ARR, and a $7M+ pipeline within 90 days. The company has achieved product-market fit and is positioned for rapid growth.","Axima AI's business model is robust, with a clear revenue generation strategy through volume-based pricing and performance-based components. The model is scalable and aligns well with the needs of their target market.","The team has shown strong execution capability by rapidly developing their product and securing contracts, indicating their ability to deliver on their vision.","The company positions itself as a comprehensive solution for revenue cycle management, differentiating itself by automating both insurance and patient payments, which most competitors do not address.","Axima AI has a clear strategic vision to address inefficiencies in healthcare revenue cycles, with a focus on underserved segments like dental and mental health groups.",axima_ai_comprehensive_analysis.json
Factos Capital,https://factoscapital.com/,2024,"Factos Capital is building a pioneering custodian and tokenised electronic register centre for Colombia and other countries of the LATAM region, enabling a secure marketplace for tokenised promissory notes, bills, factoring, and other financial instruments. Its platform fosters transparency, liquidity, and innovation in digital asset finance.","Factos Capital is solving inefficiencies and lack of trust in LATAM’s trade finance and asset registration systems. By tokenising financial instruments and offering a secure digital custodian, it enables more transparent, liquid, and accessible transactions. This unlocks capital and supports sustainable economic growth in the region.",https://factos-capital.gitbook.io/factos-capital,https://factos-landing-paula0046.replit.app/#home,4,4,3,"The founding team has strong domain expertise and a track record of working together on previous projects. The CTO and Dev Lead have relevant technical backgrounds, which is crucial for the development of their platform. However, the team size is relatively small, which could be a limitation as they scale.","The technology is innovative, focusing on tokenisation and secure digital custody. The platform is scalable and integrates well with existing systems.","Factos Capital has secured soft commitments and strategic partnerships, but is pre-launch with no active customers yet.","Factos Capital operates a B2B platform-as-a-service model, generating revenue through transaction fees, custody fees, and value-added services. This model is scalable and aligns well with industry trends.",The team has demonstrated execution capability by developing their core infrastructure and securing soft commitments from early adopters.,"The company positions itself as a comprehensive solution for tokenised financial instruments in LATAM, differentiating through its secure, regulated custodian and marketplace.","The strategic vision is strong, focusing on transparency, liquidity, and innovation in digital asset finance, which aligns with market needs.",factos_capital_comprehensive_analysis.json
Kept Inc,https://www.kept.io,2023,"Kept’s premise is to make job separation a better experience for everyone. We provide businesses and their alumni with modern, comprehensive solutions that are compliant and caring.","COBRA administration exists. Off-boarding doesn’t. Providing supportive, compassionate assistance during job transition is not only the right thing to do, it's safer from a legal and reputational standpoint.",https://docs.google.com/presentation/d/1mMaSlEoa3W4hYoHMkzP0lIvqTKjroZc-/edit?usp=sharing&ouid=108088494540414262903&rtpof=true&sd=true,https://demo.kept.io,4,3,4,"The founding team has strong domain expertise and a proven track record in building HR and benefits solutions, evidenced by their previous work at Gusto. The team is small but well-rounded, with complementary skills in engineering and operations.","The technology is built in-house, providing control over development, but lacks mention of proprietary algorithms or significant technical barriers.","Kept Inc has shown strong traction with a significant increase in ARR and a growing customer base, indicating product-market fit.","Kept Inc has a diversified revenue model with PEPM charges, commissions, and revenue sharing, which provides multiple streams of income and scalability.",The team has demonstrated execution capability by achieving significant ARR growth and securing partnerships with key industry players.,"The company positions itself as a compassionate and compliant off-boarding solution, differentiating from competitors who focus solely on compliance.",Kept Inc has a clear strategic vision to expand partnerships and enhance its product offering to cover comprehensive job transition solutions.,kept_inc_comprehensive_analysis.json
Borderless AI,https://www.hireborderless.com/hr-gpt,2023,"Borderless AI is the AI platform for HR teams and employees, everywhere. The company builds AI agents to help HR departments and employees with everything from getting on-boarded and paid - to answering questions about their vacation time and generating AI-powered expense reports.","By centralizing information, streamlining access, and providing powerful search capabilities, Borderless AI's agents perform tasks (ie: running payroll, on-boarding employees, generating employment agreements) and empowers companies to make the most of their internal knowledge. It ultimately leads to higher productivity and lower costs across their HR stack.",https://docsend.com/view/bj95389dr8atd3y5,https://www.loom.com/share/080347c9fd5e4dceadd179619d4cae5c?sid=cabe4dc7-742f-4b43-be93-d8727fb6cecf,4,4,5,"The founding team has demonstrated strong execution ability and domain expertise. The co-founders have prior entrepreneurial experience, and the team has a balanced mix of technical and business skills. The leadership team has successfully scaled the company to $5M ARR in a short period.","Borderless AI's technology is defensible with its AI-native approach and integration capabilities. The company has built its technology in-house, ensuring control over its IP.",The company has shown strong traction with $5M ARR and 200+ paying customers. The short sales cycle and high customer acquisition rate indicate strong product-market fit.,"The company has a diversified revenue model with over 10 revenue streams, which enhances scalability and reduces dependency on a single product line.",The team has shown the ability to execute by rapidly growing ARR and acquiring over 200 paying customers.,"Borderless AI positions itself as an AI-native, vertically integrated solution, differentiating from legacy platforms and modern competitors.","The company has a clear long-term vision to capitalize on the growing AI market, with strategic plans for partnerships and market expansion.",borderless_ai_comprehensive_analysis.json
Fift Health,https://fifthealth.ai,2025,"FIFT Health is an AI-powered platform that prevents heart failure readmissions through real-time monitoring, predictive alerts, and early interventions, enabling proactive care and better outcomes for high-risk patients.","We’re solving the problem of 'preventable heart failure readmissions', which affect millions of patients and are projected to cost the U.S. healthcare system over $70 billion annually by 2030. Nearly 1 in 4 heart failure patients are readmitted within 30 days—often because early warning signs like weight gain or leg swelling go unnoticed. The current system is reactive, fragmented, and lacks real-time monitoring once the patient leaves the hospital. This matters because these readmissions are not only costly but also harmful to patients’ quality of life. FIFT Health uses AI and remote monitoring to enable timely, personalized intervention—delivering better outcomes and reducing unnecessary hospitalizations.",https://docs.google.com/presentation/d/1o9sBn8QQrdBOXVD5nHVJlp7W3lqXnlfo/edit?slide=id.g36d9760d498_0_5#slide=id.g36d9760d498_0_5,http://fifthealth.ai,4,4,3,"The founding team consists of experienced medical professionals with complementary expertise in cardiology and chronic disease management. Their firsthand experience with the problem and shared vision for a solution is a strong indicator of their capability to execute. However, the team is small, and the technical development is outsourced, which could pose challenges in scaling and rapid iteration.","The technology leverages AI for predictive alerts and integrates with clinical workflows, providing a defensible position. However, the lack of in-house technical resources could pose challenges in maintaining a competitive edge.","The company has developed an MVP and established an advisory network, but lacks paying customers and significant market traction. The focus on pilot conversions is a positive step, but the lack of revenue is a concern.",FIFT Health operates a B2B SaaS model with a focus on value-based care organizations. The model is scalable and aligns well with industry trends towards preventive care. The potential for outcome-based contracts adds a layer of alignment with customer incentives.,"The team has demonstrated early execution capability by developing an MVP and establishing an advisory network. However, the lack of in-house technical resources could hinder rapid product development.",The company positions itself as a proactive care enabler with a unique combination of AI and human-centered design. This differentiation is crucial in a market where many competitors focus solely on data capture.,"The strategic vision is well-aligned with market needs, focusing on reducing readmissions and improving patient outcomes. The founders' medical backgrounds provide a deep understanding of the problem space.",fift_health_comprehensive_analysis.json
Whynda,https://whynda.com/,2023,Peer-to-peer rental marketplace for heavy machinery equipment,"Equipment owners struggle to rent out their heavy machinery while general contractors have a hard time finding the equipment they need seamlessly without having to negotiate prices. Additionally, there's no way for either to know if they're trustworthy. That's why we're facilitating that connection and enabling ratings functionalities in addition to individual authentication. Combined, this becomes an incredibly time consuming process where both parties are losing out on revenue and suffering because of the lack of accountability in the industry.",https://bit.ly/Whynda_Pitch_Deck,https://bit.ly/Whynda_Demo_Site,4,3,4,"The founding team of Whynda demonstrates strong complementary skills and domain expertise. Veronica Marshall, the CEO, has significant experience in leasing and sales within the construction industry, which is crucial for understanding the market and customer needs. Roberto Garcia, the CTO, brings technical expertise from his background in tech companies, particularly in community-based and B2B SaaS models. The team is small but well-rounded, with a clear division of responsibilities that aligns with their backgrounds.","Whynda's technology focuses on facilitating peer-to-peer rentals with a strong emphasis on trust and transparency. While the platform is still in development, the use of ratings and authentication provides a competitive edge.","Whynda has demonstrated strong initial traction with 200 LOIs from equipment owners and a waitlist of 1,800 renters. This indicates significant interest and potential product-market fit.",Whynda's business model is based on transaction fees from rentals and additional revenue from OSHA certification modules. This model is scalable and leverages the growing trend of peer-to-peer marketplaces.,"The team has demonstrated execution capability by securing 200 LOIs from equipment owners and a waitlist of 1,800 renters, indicating strong initial traction.","Whynda positions itself as a transparent and trustworthy platform, addressing key pain points in the heavy machinery rental market. Its differentiation lies in its focus on trust and accountability through ratings and authentication.","The strategic vision is clear, focusing on solving significant industry pain points and leveraging Veronica's industry network for market entry.",whynda_comprehensive_analysis.json
