company_name,website,year_founded,description,problem_statement,pitch_deck_link,demo_link,Team_Score,Technology_Score,Traction_Score,Team_Justification,Technology_Justification,Traction_Justification,Team_Business Model Strength,Team_Execution Capability,Team_Market Positioning,Team_Strategic Vision,file_name
Kaatch,https://www.kaatch.co/,2024,"Kaatch helps fast-growing companies access vetted, senior HR experts, on demand. We offer flexible, project-based support across talent, people ops, compliance, and culture, without the rigidity of agencies or the noise of marketplaces. Our model is curated, human-first, and built for startups and scaleups that treat HR as strategic.","Startups and scaleups face urgent HR challenges: hiring, retention, compliance, culture but often lack the internal capacity or expertise to solve them. Traditional solutions like agencies or full-time hires are slow, rigid, or too expensive. We know that people decisions are business decisions and too many fast-growing companies get them wrong when they can’t access the right expertise in time.",https://www.canva.com/design/DAGd3vkllSE/UzHCbhOa7eOulCdL3dbCtg/edit?utm_content=DAGd3vkllSE&utm_campaign=designshare&utm_medium=link2&utm_source=sharebutton,https://www.loom.com/share/eab86519fbe24d5e9d7be6edb608556f?sid=689f45f2-549a-4734-bbc4-f04884c72fab,4,3,4,"The founding team of Kaatch demonstrates strong execution ability and domain expertise. Emmanuel Djengue (CEO) has a solid background in HR and innovation projects, while Nayram Mensah (CTO) brings significant technical expertise from previous successful startups. Alvaro Jimenez (COO) complements the team with operational experience. The team has a proven track record of collaboration and a clear understanding of the HR tech space.","Kaatch's technology is built by a seasoned CTO with experience in successful startups. However, there is limited information on proprietary technology or IP protection.",Kaatch has demonstrated strong early traction with over €100k in GMV and 10 paying clients. The company has a fast sales cycle and a clear understanding of its target market.,"Kaatch operates on a commission-based model, taking a margin on the expert’s rate. This model is scalable and aligns with the needs of startups seeking flexible HR solutions.",The team has demonstrated the ability to execute by launching in the market and generating over €100k in GMV within a short period.,"Kaatch positions itself as a curated, human-first alternative to traditional HR agencies and marketplaces, focusing on startups and scaleups.","Kaatch has a clear strategic vision to address the HR needs of fast-growing companies with a flexible, project-based approach.",kaatch_comprehensive_analysis.json
Multiply,https://www.multiplymortgage.com,2022,"Multiply helps employees navigate the largest purchase of their life: buying a home. Its financial wellness benefit offers mortgage interest rate discounts of up to 0.75%, unlimited 1:1s with mortgage expert advisors, and employee education sessions covering the home purchase and financing process, all with zero cost for the company.","Almost two-thirds of Americans feel priced out of home ownership due to rising home prices and interest rates. Many are intimidated by a complex and consequential transaction that they don’t know how to navigate, which can distract and erode performance at work. We are solving affordability, access, and stress in homeownership through a first-of-its-kind mortgage employee benefit program.",https://docsend.com/view/9bxwwvz6xjh4hz5h,https://www.multiplymortgage.com/anduril,4,4,5,"The founding team of Multiply has strong domain expertise and a track record of success in relevant industries. Michael White and Gautam Gupta bring experience from high-growth companies like Square, DoorDash, Uber, and Opendoor, which is indicative of their ability to scale operations and execute on strategic visions.","Multiply's technology leverages AI for efficient transaction fulfillment and offers a seamless user experience, providing a competitive moat.","Multiply has demonstrated strong traction with rapid growth in company partnerships and positive customer feedback, indicating strong product-market fit.","Multiply's revenue model is based on earning commissions from mortgage origination, which is scalable and aligns with their value proposition of offering a free benefit to companies and employees.",The team has demonstrated strong execution capability by launching their product and rapidly expanding their customer base.,"The company positions itself uniquely by offering a mortgage benefit program that is free to employers and employees, differentiating itself from traditional lenders.","Multiply has a clear strategic vision to leverage channel partners for scaled employer acquisition, which aligns with their long-term growth objectives.",multiply_comprehensive_analysis.json
TietAI,https://www.tiet.ai,2025,"Tiet.ai provides AI-powered healthcare data integration for the European Health Data Space era. Our platform transforms fragmented health data into FHIR-compliant, interoperable formats in weeks, not years. Led by team with algorithm development and medical device regulatory expertise, enabling hospitals to achieve EHDS compliance.","European healthcare generates massive data daily, yet citizens can't easily access their health records electronically, and researchers struggle to use this data for improved treatments. With 27 EU countries using incompatible healthcare systems and the EHDS compliance deadline of March 2027, healthcare organizations urgently need AI-powered data integration that ensures regulatory compliance while enabling interoperability. This matters because fragmented data prevents better patient outcomes, slows medical research, and hinders evidence-based healthcare policy.",https://tietai.docsend.com/view/xygk29xz85zvndne,https://www.tiet.ai,4,5,4,"The founding team has strong domain expertise in AI and healthcare data integration, with a proven track record of collaboration and execution in real-world healthcare settings. Their complementary skills and shared vision enhance their ability to lead TietAI effectively.","TietAI's technology is highly differentiated with a focus on healthcare-specific compliance and interoperability, supported by strong technical expertise and in-house development.","TietAI has demonstrated strong traction through successful technical validation with major hospitals and a clear path to commercial pilots, supported by a validated business model.","TietAI employs a B2B SaaS subscription model with validated pricing and strong unit economics, targeting a significant market need for EHDS compliance.",The team has demonstrated execution capability through successful technical validation with major hospitals and a clear path to commercial pilots.,"The company positions itself as a specialized EHDS-native solution, differentiating from generic ETL platforms by focusing on healthcare-specific compliance and interoperability.","TietAI's strategic vision aligns with the urgent market need for EHDS compliance, positioning them well for growth in the European healthcare data integration market.",tietai_comprehensive_analysis.json
Value Buddy,https://www.hellovaluebuddy.com/,2023,"Value Buddy is an AI-powered underwriting valuation platform for M&A bankers, business brokers, and SBA lenders who have a slow, expensive underwriting process. Value Buddy provides a streamlined valuation and risk management platform that significantly reduces the cost and time to create valuation reports.","- SBA lenders are losing accounts due to slow (up to 1 month), expensive (up to $8K) loan closing processes
- SBA lenders are seeing a 5x higher default rate on these loans than the avg. commercial loan

Solution: Value Buddy provides an AI-powered valuation platform built on data from millions of private business transactions and leading economic reports to create customized risk factor analysis and lending insights to banks seeking to finance small business acquisitions.",https://drive.google.com/file/d/1FIGaQvwqlzeffLE5QO7z2hU_dK7oLgiN/view?usp=drive_link,https://tinyurl.com/valuebuddydemo,4,4,5,"The founding team has strong domain expertise in valuation, with both founders having backgrounds in this area. The team is small but has shown capability in building the product internally and achieving significant traction.","Value Buddy's technology is built internally, leveraging AI for valuation and risk assessment. The platform is scalable and offers significant technical differentiation.","Strong traction with significant revenue growth, customer acquisition, and market validation. The company has demonstrated product-market fit and effective go-to-market execution.",Value Buddy has a strong revenue model with high gross margins (92% on certified valuations and 98% on non-certified valuations). The business model is scalable with a SaaS platform and referral partner revenue.,The team has demonstrated execution capability by achieving a 422% YoY growth and securing 20 bank customers.,"The company positions itself as a cost-effective and fast alternative to traditional valuation services, leveraging AI to provide unique risk assessments.","The strategic vision includes expanding the customer base to financial advisors and business brokers, indicating a clear understanding of market opportunities.",value_buddy_comprehensive_analysis.json
ProjectSet,https://projectset.com,2019,"70% students graduate w/o the skills employers want. 67% students want work-based learning to build skills - only 2% find them. We give students unlimited, personalized WBL projects based on their career goal.","We’re closing the opportunity gap by equipping students with the durable skills they need to succeed in the future of work no matter their background. These skills are the real differentiators in today’s job market, yet they’re often the most overlooked in education. By making soft skill development measurable, visible, and actionable through our platform, we empower students, educators, and institutions to focus on what truly matters for employability. Our work directly contributes to fairer, more inclusive pathways to success helping students not just learn, but thrive.",https://www.canva.com/design/DAGcQYvc7-c/QFed2TuA5CJXrJhIvQ1yDA/view?utm_content=DAGcQYvc7-c&utm_campaign=designshare&utm_medium=link2&utm_source=uniquelinks&utlId=h5664599475,https://www.canva.com/design/DAGkC4D9d8o/Y-xLIX-WNqxKcn8BQBixkg/watch?utm_content=DAGkC4D9d8o&utm_campaign=designshare&utm_medium=link2&utm_source=uniquelinks&utlId=he8ca36a506,4,3,4,"The founding team of ProjectSet demonstrates strong execution ability and domain expertise. Dhruva Banerjee, the CEO, has extensive experience in consulting with multinational corporations and has personally coached students in project-based learning. Safa Irfan, the Product Manager, brings experience from a previous startup and has firsthand experience with project-based learning. The team is small but focused, with a clear division of roles across operations, product, engineering, and R&D.","ProjectSet's technology focuses on personalization and skill measurement, providing a competitive advantage. However, the technical defensibility and scalability need further validation.",ProjectSet has demonstrated strong traction with 150% revenue growth and a 100% increase in user base. The company has secured notable B2B customers and partnerships.,"ProjectSet has a diversified revenue model targeting employers, schools, and universities. The model includes sponsorships, subscriptions, and talent scouting fees, indicating scalability and potential for significant revenue generation.",The team has demonstrated strong execution capability with 150% revenue growth and a 100% increase in user base over the last six months.,"The company positions itself as a personalized work-based learning platform, differentiating through its focus on soft skill measurement and personalization.","ProjectSet has a clear strategic vision to close the opportunity gap in education by focusing on durable skills, with plans to refine its go-to-market strategy and strengthen distribution.",projectset_comprehensive_analysis.json
Kottackal Technologies QFZ LLC,https://www.kottackal.org,2024,"We have developed an Energy hub platform called GreenPoint that connects Energy producers with Energy consumers in Energy hubs like smart city, ports or fleets.

GreenPoint provides the below value:

1) Single interface for energy concentration hub manager / owner to operate, manage and plan their facility
2) Data aggregation for all the energy data that passes through the facility

For this innovation, we were one of the finalist in the AEMOB Innovation forum, Qatar. We are also piloting the platform with Hamad Bin Khalifa University in Qatar.","Today, the energy - mobility sector requires a prior trust relationship before any services could be availed. For example, for charging, the user needs prior registration and approval by the service providers.

Further the data is siloed and stored with the respective service provider.

This means that the facility manager of an energy concentration hub like smart city or port would need to access the indivitual applications to access the data. 

This is cumbersome and inefficient.

GreenPoint aggregates energy data across platform and provides a single interface for the facility manager.",https://www.dropbox.com/scl/fi/o7dnxw4oz6uctlstq8b66/Kottackal_GreenPoint_25.pdf?rlkey=xo7i5339muq03yoquom56zzqe&st=6rd6bdfa&dl=0,https://vimeo.com/1081766625,3,4,2,"The team is currently led by a single founder, Jacob Ninan, who has developed the GreenPoint platform in-house. While the founder has demonstrated technical capability and innovation, the lack of a co-founding team with complementary skills could be a limitation in scaling the business.","The technology is innovative, focusing on data aggregation and future AI applications. The in-house development indicates strong technical capability, but scalability and integration with existing systems need further validation.","The company is in the early stages with a single pilot project. While this demonstrates initial traction, broader market validation and customer acquisition are needed.","The business model is B2B, charging fees based on cost savings for customers. This model aligns with industry practices but lacks clarity on pricing structure and scalability.","The team has successfully developed and piloted the platform, indicating execution capability. However, scaling operations with a small team could be challenging.","The company positions itself as a data aggregator for energy hubs, offering a unique value proposition in simplifying data access for facility managers.","The strategic vision is focused on leveraging data analytics for future AI use-cases, which is forward-thinking but requires further validation and market fit.",kottackal_technologies_qfz_llc_comprehensive_analysis.json
The After Cancer,https://www.theaftercancer.com,2023,"The After Cancer enables organizations to launch scalable, virtual survivorship programs by merging their clinical expertise with our technology. We deliver personalized care plans addressing patients’ side effects, mental health, and recurrence risk, while aligning oncology stakeholders to improve patient outcomes and lower costs through real-world data.","As a society, we invested heavily in better cancer treatments and earlier diagnoses and we’re now seeing the results: over 18 million cancer survivors in the US. Survivors face ongoing challenges, with 74% experiencing physical and psychosocial side effects such as pain, fatigue, and distress. As survival rates climb, the demand for long-term care to manage side effects and prevent recurrence is outpacing the growth in supply. Healthcare has been slow to adapt. Survivorship programs, proven to improve outcomes and reduce recurrence, are absent in most hospitals due to a lack of staff, limited expertise, insufficient infrastructure, and difficulty tracking patient outcomes. This leaves survivors navigating recovery alone, leading to worse health outcomes and higher costs across the system. This challenge will only intensify. Cancer incidence is rising, in particular for younger generations, creating a growing population at high risk for late effects of treatment and potential cancer recurrence. Without adequate long-term support, these patients are likely to reenter the healthcare system in costly and preventable ways, affecting every stakeholder in oncology from patients and providers to payers.",https://docsend.com/view/msnmd9mu6tdtdpcd,https://youtu.be/YSC8zJHF5jE,4,4,4,"The founding team has a strong blend of domain expertise, technical skills, and leadership experience. Mariana Arnaut and Caroline Knudsen bring strategic and operational expertise from their MBA backgrounds, while Dr. Chasse Bailey-Dorton provides deep clinical insights. Thierry Silbermann's technical leadership in AI and machine learning adds a robust technical foundation.",The platform's technical differentiation lies in its ability to empower healthcare organizations to create scalable survivorship programs. The use of real-world data and personalized care plans adds defensibility.,"The company has demonstrated strong early traction with 304 MVP users, 5 closed customers, and a robust sales pipeline. The focus on B2B2C growth and strategic partnerships is promising.",The B2B2C model with annual subscription agreements is scalable and aligns with industry trends. The focus on oncology stakeholders provides a clear path to revenue diversification.,"The team has demonstrated execution capability by launching an MVP, securing early traction, and building a strong sales pipeline.","The company positions itself as a technology enabler for survivorship programs, differentiating from competitors by avoiding reliance on in-house nurse teams.","The strategic vision is clear, focusing on empowering healthcare organizations to deliver scalable survivorship care, with plans to expand revenue streams across the oncology ecosystem.",theaftercancer_comprehensive_analysis.json
Bluespine,https://www.bluespine.io,2024,"Bluespine is an AI-powered pre/post-payment integrity platform that empowers employers and carriers/TPAs to reduce FWA in healthcare through the discovery and prevention of medical and pharmaceutical overbilling. It detects overbilling by generating employer or provider-specific rulesets, enabling a customizable claims review process that yields evidence-based results.","Employers face significant fiduciary and regulatory risks due to overbilling errors in medical and pharmaceutical claims. Without robust pre-payment review solutions, they struggle to prevent unnecessary healthcare spending and face exposure to ERISA violations. Bluespine's AI-powered platform addresses these challenges by applying employer-specific rulesets to claims, ensuring cost containment and regulatory compliance. For carriers, Bluespine reduces FWA-related losses and operational costs by enabling customizable, provider-specific rulesets and conducting automated, evidence-based reviews of claims.",https://docsend.com/view/7cfucdw4fdmmnn9u,https://bluespine.docsend.com/view/fahagyemi48qwupf,4,4,4,"The founding team has strong domain expertise and a proven track record in the industry. The team is well-rounded with complementary skills in technology and business development, which is crucial for scaling the company.","Bluespine's technology is innovative and defensible, leveraging AI to create customizable rulesets for claims review. The platform's scalability and technical architecture are well-suited for growth.",Bluespine has demonstrated strong traction with a growing customer base and positive market validation. The company is well-positioned to scale its operations and expand its market presence.,"Bluespine's business model is robust, combining annual product fees with a percentage of savings, and recently introducing a PMPM model. This aligns incentives with customers and supports scalability.",The team has demonstrated strong execution capability by deploying the platform and expanding its customer base within a short timeframe.,"Bluespine positions itself as a leader in AI-powered payment integrity solutions, differentiating through customizable rulesets and evidence-based results.",The leadership has a clear strategic vision to address complex healthcare billing issues and expand their market presence.,bluespine_comprehensive_analysis.json
RituWell,https://www.jetsweatfitness.com/whoweserve/employers,2023,"RituWell is a B2B digital wellness platform that empowers organizations to drive tailored well-being initiatives and achieve sustained health outcomes. We partner with forward-thinking employers, health plans and health systems to set a new standard for holistic and preventative care, reducing healthcare expenses and improving productivity and retention. RituWell is the first truly integrated platform offering a dedicated infrastructure for optimal performance, privacy and engagement.","Employers are seeing soaring healthcare spending, and physically and mentally unhealthy employees while our health plans continue to focus on reactive rather than preventative care. Retention is at its lowest in 10 years, with $322 billion lost annually in turnover and productivity from employee burnout alone. 1 in 4 remote workers is also reporting loneliness which is having further devastating effects on physical and mental health.",https://docsend.com/view/rabskx99nnsnxmj5,https://youtu.be/VYnyURbwZhU?si=veA-8yJ4Nj45ZYzs,4,3,4,"The founding team of RituWell demonstrates strong execution ability and domain expertise. Alexandra Dantzig, CEO, and Erin Frankel, Chief Content Officer, bring complementary skills with Alexandra's leadership and Erin's content development expertise. The team has a clear understanding of the wellness and healthcare industry, evidenced by their strategic pivot from a consumer model to a B2B platform.","RituWell's technology is integrated and customizable, but lacks explicit technical defensibility details.",Strong initial traction with a significant sales pipeline and pilot implementation. Engagement stats indicate product-market fit.,"RituWell employs a PEPM model, which is scalable and aligns with industry standards. The model allows for predictable revenue streams and potential upsell opportunities.","The team has demonstrated execution capability by building a platform, securing supplier contracts, and generating a significant sales pipeline.","RituWell positions itself as an integrated wellness platform, differentiating from point solutions by offering a comprehensive, customizable experience.","The strategic vision is well-aligned with market trends towards preventative care and workplace wellness, supported by industry reports and customer feedback.",rituwell_comprehensive_analysis.json
Bogaisa Pty Ltd,https://bogaisapty.com,2024,Cash and liquidity management through AI powered platform for SMEs.,SMEs are failing due to poor financial management and unclear insights into cash management and financial health. Bogaisa helps them overcome that challenge.,https://drive.google.com/file/d/1PGFeTjQEYT0XmLis-K4TfaRScNK6RrH4/view?usp=drivesdk,https://melo.bogaisapty.com,3,3,2,"The founding team consists of two members with complementary skills in technology and operations. Solofelang Mosoang, the CEO, has technical expertise and has built the platform himself, indicating strong execution ability. However, the team lacks experience in scaling businesses and has no prior entrepreneurial successes. The small team size and lack of a sales team are significant concerns.","The platform is built using AI, which provides a technical advantage, but there is no evidence of proprietary technology or IP protection.","The company is in beta testing with no current customers, indicating limited traction and market validation.","The business model relies on subscriptions and consulting fees, which can provide recurring revenue. However, the lack of current customers and a sales strategy is a concern.","The team has developed a beta product, but there is no evidence of market traction or customer acquisition.","Bogaisa aims to differentiate by providing comprehensive financial insights beyond cash forecasting, but the competitive landscape is crowded with established players.","The vision to support SMEs with financial management is clear, but the strategic plan to capture market share is underdeveloped.",bogaisa_pty_ltd_comprehensive_analysis.json
